,score,text,token_review
0,2,어이가 없다 나라꼴 참,"['어이', '가', '없다', '나라', '꼴', '참']"
1,2,이게뭐하는 짓거리야  헌법이 사이비종교의 교리보다 못한나라 쓰레기진보 대법관들   ,"['이', '게뭐', '하', '는', '짓거리', '야', '헌법', '이', '사이비종교', '의', '교리', '보다', '못', '한나라', '쓰레기', '진보', '대법관', '들']"
2,2,소수의 의견을 이렇게 잘들어주는 나라였어ㅋ 그럼 난 정부와 국회가 세금을 너무 흥청망청 쓰는게 비양심적으로 쓰는것같으니 앞으로 양심적 세금 납부 거부운동해야겠다 언제까지 나라가 세금 다시 잘쓸때까지 어차피 세금납부도국민의의무이니깐 소수의견들어줘야지ㅋ,"['소수', '의', '의견', '을', '이렇게', '잘', '들어주는', '나라였어', 'ㅋ', '그럼', '난', '정부', '와', '국회', '가', '세금', '을', '너무', '흥청망청', '쓰는게', '비', '양심', '적', '으로', '쓰는것', '같으니', '앞', '으로', '양심', '적', '세금', '납부', '거부', '운동', '해야겠다', '언제', '까지', '나라', '가', '세금', '다시', '잘쓸', '때', '까지', '어차피', '세금', '납부', '도', '국민', '의', '의무', '이', '니깐', '소', '수', '의견', '들어줘야지', 'ㅋ']"
3,2,문재인이 2년도 채 되지 않아 나라를 개박살내는데 성공했구나 경제 정치 종교 다 개박살내네,"['문재인', '이', '2년', '도', '채', '되지', '않아', '나라', '를', '개', '박살', '내는데', '성공했구나', '경제', '정치', '종교', '다', '개', '박살', '내네']"
4,2,옛날 승병들은 양심이없어 살생하지말라는 교리를 어겨가며  살생까지하면서  나라를지컸냐 나라가 있어야 종교가 존재하거늘 이러니  흔해빠진 국교하나없고 종교백화점이란 소리를 듣지   어휴 돌아이들,"['옛날', '승', '병들은', '양심', '이', '없어', '살생', '하지말라는', '교리', '를', '어겨가며', '살생', '까지', '하면서', '나라', '를', '지', '컸냐', '나라', '가', '있어야', '종교', '가', '존', '재하거늘', '이러니', '흔해', '빠진', '국교', '하', '나', '없고', '종교', '백화점', '이란', '소리', '를', '듣지', '어휴', '돌아이', '들']"
5,2,확실한건 빨갱이정권 들어서고 나라가 혼란해지고 옳고그름에 대한 경계가 모호해짐,"['확실한건', '빨갱이', '정권', '들어서고', '나라', '가', '혼란', '해지고', '옳고', '그', '름', '에', '대한', '경계', '가', '모호해', '짐']"
6,2,저새기들 논리면 같은4대의무인 납세의무도 양심적탈세 가능한부분 ㅇㅈ 병역이 비양심이면세금내는것도 비양심이지,"['저', '새', '기', '들', '논리', '면', '같은', '4', '대의', '무인', '납세의무', '도', '양심', '적', '탈세', '가능한', '부분', 'ㅇㅈ', '병역', '이', '비', '양심', '이', '면', '세금', '내는것도', '비양', '심이지']"
7,2,군대가면 비양심 안가면 양심 나라가미쳐가는구만,"['군대', '가면', '비', '양심', '안', '가면', '양심', '나라', '가', '미쳐가는구만']"
8,2,진보 좌파가 이래서 무서운거야 국가 존립자체를 흔들고 공권력 부수는데 그 근본이 있거든 재인이 역시 ㅉㅉㅉ,"['진보', '좌파', '가', '이래서', '무서운거야', '국가', '존립', '자체', '를', '흔들고', '공권력', '부수는데', '그', '근본', '이', '있거든', '재인', '이', '역시', 'ㅉㅉㅉ']"
9,2,문재인의 큰그림 대한민국 군대해산 여호와는 미끼일뿐,"['문재인', '의', '큰', '그림', '대한민국', '군대', '해산', '여호와', '는', '미끼', '일', '뿐']"
10,2,625참전해서 대한민국 지킨 군인들 양심없는거네 저것들이 양심적 병역 거부면 그래도 우리나라에서 배웟다고 판사까지하는것들이 뭐하는짓인지,"['625', '참전', '해서', '대한민국', '지킨', '군', '인들', '양심', '없는거네', '저', '것', '들', '이', '양심', '적', '병역', '거부', '면', '그래도', '우리나라', '에서', '배웟다', '고', '판사', '까지', '하는것', '들이', '뭐', '하는', '짓', '인지']"
11,2,장로교 침례교 성결교 등 일반 정통기독교단의 교회들은 양심이 없어서 자녀와 성도를 군대 갔다 오라 하는 줄 아십니까 작년 추운겨울 국가의 부르심을받고 입대하는 아들을 훈련소에서 보내며 소리없이 울었습니다 우리가 하나님의 부르심을 받고 이 땅에서열심히 사는만큼내가속해 있는국가가나를부르고또내아들을필요로한다면보내야지뜨거운눈물이흘렀습니다나의희생없는애국이란존재하지않습니다 나의 헌신없는 조국이란 없습니다 많은 선배들의 희생과 헌신이 있었기에 오늘 우리가 있음을 기억했음  합니다,"['장로교', '침례교', '성결교', '등', '일반', '정통', '기독', '교단', '의', '교회', '들', '은', '양심', '이', '없어서', '자녀', '와', '성도', '를', '군대', '갔다', '오라', '하는', '줄', '아십니까', '작년', '추운', '겨울', '국가', '의', '부르', '심', '을', '받고', '입대', '하는', '아들', '을', '훈련소', '에서', '보내며', '소리', '없이', '울었습니다', '우리', '가', '하나님', '의', '부르', '심', '을', '받고', '이', '땅', '에서', '열심히', '사는만큼', '내', '가속', '해', '있는', '국가', '가나', '를', '부르고', '또', '내', '아들', '을', '필요', '로', '한', '다', '면', '보내야지', '뜨거운', '눈물', '이', '흘렀습니다', '나', '의', '희생', '없는', '애국', '이란', '존재', '하', '지', '않습니다', '나', '의', '헌신', '없는', '조국', '이란', '없습니다', '많은', '선배', '들', '의', '희생', '과', '헌신', '이', '있었기에', '오늘', '우리', '가', '있', '음', '을', '기억', '했음', '합니다']"
12,2,문재앙에게 충성한다고 사법부가 양심을 팔았다  이제 군대해산해야지 ㅋㅋ 누가 가겠냐,"['문', '재앙', '에게', '충성', '한다고', '사법부', '가', '양심', '을', '팔았다', '이제', '군대', '해산', '해야지', 'ㅋㅋ', '누가', '가겠냐']"
13,2,종교가법위에군림하게됐다   판사새끼들부터적폐다   대체복무지를  지뢰제거와신안염전으로보내라,"['종교', '가법', '위', '에', '군림', '하', '게', '됐다', '판사', '새끼', '들', '부터', '적폐', '다', '대체복무', '지를', '지뢰', '제거', '와', '신안', '염전', '으로', '보내라']"
14,2,이쯤 되면 개판친거죠 문슬람 개돼지들의 나라   축 나라망함,"['이쯤', '되면', '개판', '친거죠', '문슬람', '개돼지', '들', '의', '나라', '축', '나라', '망함']"
15,2,군인에게 여객기일등석을 양보하도록 하는 미국과 달리 한국은 할머니가 위독하여 청원휴가나왔다가 버스를 못탄 군인을 공짜로 태웠다가 성차별이라는 항의받고 해당 버스기사가 사과문까지 올렸다 한국은 이스라엘처럼 남녀 공동병역의무가아닌데 어떻게 성차별이 되는지군가산점폐지되고모여대를중심으로군비하퍼포먼스를하는데도폭동한번안일어난 것보면다행이라고해야될지불행이라고해야될지모르겠다,"['군인', '에게', '여객기', '일등석', '을', '양보', '하도록', '하는', '미국', '과', '달리', '한국', '은', '할머니', '가', '위독하여', '청원', '휴가', '나왔다가', '버스', '를', '못', '탄', '군인', '을', '공짜', '로', '태웠다가', '성차별', '이라는', '항의', '받고', '해당', '버스', '기사', '가', '사과문', '까지', '올렸다', '한국', '은', '이스라엘', '처럼', '남녀', '공', '동', '병역의무', '가', '아닌데', '어떻게', '성차별', '이', '되는지', '군가산점', '폐지', '되', '고모', '여대', '를', '중심', '으로', '군비', '하', '퍼포먼스', '를', '하는데도', '폭동', '한', '번안', '일어난', '것', '보면', '다행', '이라고', '해야', '될지', '불행', '이라고', '해야', '될지', '모르겠다']"
16,2,판사중에 혹시 저 종교믿는인간 있나어째 이 정권들어오고나선 개뼈다귀같은 판결만 수두룩한지허긴 대통령조차도 자기멋대로 우리분사경계선마저도 막퍼주고있으니독자적인 요상한행보에 할말이없다ㅎㅎㅎ,"['판사', '중', '에', '혹시', '저', '종교', '믿는', '인간', '있나어', '째', '이', '정권', '들어오고', '나선', '개뼈', '다', '귀', '같은', '판결', '만', '수두', '룩', '한지', '허긴', '대통령', '조차도', '자기', '멋대로', '우리', '분', '사경', '계', '선', '마저도', '막퍼주고있으니', '독자', '적', '인', '요', '상한', '행보', '에', '할말이', '없다', 'ㅎㅎㅎ']"
17,2,이럴거면 유승준은 왜 비난했냐,"['이럴거면', '유승준', '은', '왜', '비난', '했냐']"
18,2,저런 사람들이 판사질을 하고 있다 정말 안타깝다 더우기 대법관의 자리가 어느 자리인지 알고나 있는 자 들인가 5천만 동포가 저들의 재판에 놀아나야 한다니 어쩌다가 이렇게 되었나,"['저런', '사람', '들', '이', '판사', '질', '을', '하고', '있다', '정말', '안타깝다', '더우기', '대법관', '의', '자리', '가', '어느', '자리', '인지', '알고나', '있는', '자', '들인가', '5천만', '동포', '가', '저', '들', '의', '재판', '에', '놀아나야', '한다니', '어쩌다가', '이렇게', '되었나']"
19,2,이번 판결은 울나라 역사 끝까지 욕처먹을 판결이 될것이다,"['이번', '판결', '은', '울', '나라', '역사', '끝', '까지', '욕처', '먹을', '판결', '이', '될것이다']"
20,2,그동안 군대에서 돌아가신 분들은 양심이 없어서 순국하셨나 진짜 너무 화난다ㅜㅜ,"['그동안', '군대', '에서', '돌아가신', '분', '들', '은', '양심', '이', '없어서', '순국', '하셨나', '진짜', '너무', '화난다', 'ㅜㅜ']"
21,2,이게 나라냐 문빨정권 들어서고 나라가 개판이네 주사파 림종석이가 뒤에서 떡 버티고 재이니 조종하는게 확실하네,"['이', '게', '나라', '냐', '문', '빨', '정권', '들어서고', '나라', '가', '개판', '이네', '주사파', '림종', '석', '이', '가', '뒤', '에서', '떡', '버티고', '재', '이니', '조종', '하는게', '확실하네']"
22,2,이 정부가 잘하는게 뭐냐제발 알려줘라ㅠㅠ,"['이', '정부', '가', '잘', '하는게', '뭐', '냐', '제발', '알려줘라', 'ㅠㅠ']"
23,0,왜 그 신념을 가진 사람을 특정 종교인에 한정하나요 다른사람은 살인행위가 아무렇지도 않을까요 누구에게나 살인은 괴로운 일입니다 하지만 죽여야 합니다 안그러면 본인과 가족 이웃이 죽어야하니까요 세상은 잔혹한곳입니다전쟁이나면 '살인은 신념에반하는 행동이야전쟁안해'라는어리광은안먹혀요나라를지키고있는사람들에게본인이보호받고있었고앞으로도그럴것이기때문에본인도무기를들고 다른 사람을 지킬 의무가 있습니다 군복무는 가만히 총들고있다 오는게 아니라 전시에 목숨걸고 싸울거라는 전제가 있는겁니다,"['왜', '그', '신념', '을', '가진', '사람', '을', '특정', '종교인', '에', '한정', '하나요', '다른사람', '은', '살인', '행위', '가', '아무렇지도', '않을까요', '누구', '에게나', '살인', '은', '괴로운', '일', '입니다', '하지만', '죽여야', '합니다', '안', '그러면', '본인', '과', '가족', '이웃', '이', '죽어야하니까', '요', '세상', '은', '잔혹한', '곳', '입니다', '전쟁', '이나', '면', ""'"", '살인', '은', '신념', '에', '반하는', '행동', '이야', '전쟁', '안해', ""'"", '라는', '어리광', '은', '안', '먹혀', '요나라', '를', '지키고있는', '사람', '들', '에게', '본인', '이', '보호', '받고있었고', '앞', '으로도', '그럴것이기', '때문', '에', '본인', '도', '무기', '를', '들고', '다른', '사람', '을', '지킬', '의무', '가', '있습니다', '군복무', '는', '가만히', '총', '들', '고', '있다', '오는게', '아니라', '전시', '에', '목숨', '걸고', '싸울거라는', '전제', '가', '있는', '겁니다']"
24,0,아들만 둘 있는 엄마 입니다 한아이는 12월 전역이고 작은 아들은 2년후에 입대 예정인데 제가 잘못하고 있는건가요저희는 해외에서 18년째 살면서 국방의 의무를 하기위해 당연히 보내야 한다고 생각했고 그래야 대한민국 국민으로보호받고 자격이 주어진다는걸로 암니다 근데이번판결은제가생각하고있는기본상식에너무어긋나서 이해가안갑니다 21개월동안고생하며나라지킨이들에대한 아주잘못된판결이라고 생각됩니다 군애간 아들은 어디 시간이 남아돌고 양심이 없어서 간것이 아닙니다,"['아들', '만', '둘', '있는', '엄마', '입니다', '한', '아이', '는', '12월', '전역', '이고', '작은', '아들', '은', '2년', '후에', '입대', '예정', '인데', '제', '가', '잘못', '하고', '있는건', '가요', '저희', '는', '해외', '에서', '18년', '째', '살면서', '국방', '의', '의무', '를', '하기', '위해', '당연히', '보내야', '한다고', '생각', '했고', '그', '래야', '대한민국', '국민', '으로', '보호', '받고', '자격', '이', '주어진다', '는걸', '로', '암', '니', '다', '근데', '이번', '판결', '은제', '가', '생각', '하고', '있는기', '본상', '식', '에', '너무', '어긋나서', '이해', '가안', '갑니다', '21', '개', '월동', '안', '고생', '하', '며', '나라', '지킨이', '들에', '대한', '아주', '잘', '못', '된', '판결', '이라고', '생각', '됩니다', '군애', '간', '아들', '은', '어디', '시간', '이', '남아돌고', '양심', '이', '없어서', '간것이', '아닙니다']"
25,0,종교의 문제가 아니고 무장해제 및 군대 와해의 목적으로 보인다,"['종교', '의', '문제', '가', '아니고', '무장해제', '및', '군대', '와', '해', '의', '목적', '으로', '보인다']"
26,0,민주당 뽑지않겠다,"['민주당', '뽑지', '않겠다']"
27,0,나라가 어려울때 마다 목숨걸고 싸운 의병이나 승려들 외국적 포기하고 입대하는 청년앞에 부끄럽습니다내가족 내나라를 지켜야 한다는 맘보다 나만 살겠다고 하네요복무단축병력감축한다고통일되면 아들 군대안간다고 기대하는 어머니들 정서도 문제라고 봅니다통일후 국경이 중국과러시아가될텐데국방의무는더강조되야하는거 아닌가요 누구는 전쟁하고 싶은가요 나라가 강해야 전쟁을 안하는데차포빼면 장기는 뭘로 두나요 법이 교리보다 밑에 있는거 맞나요 양심적 신념으로 납세거부하면 그것도 무죄인가요,"['나라', '가', '어려울', '때', '마다', '목숨', '걸고', '싸운', '의병', '이나', '승려', '들', '외국', '적', '포기', '하고', '입대', '하는', '청년', '앞', '에', '부끄럽습니다', '내', '가족', '내나라', '를', '지켜야', '한다는', '맘보', '다', '나', '만', '살겠다고', '하네요', '복무', '단축', '병력', '감축', '한', '다', '고통', '일되', '면', '아들', '군대', '안', '간다', '고', '기대하는', '어머니', '들', '정서', '도', '문제', '라고', '봅니다', '통일', '후', '국경', '이', '중국', '과', '러시아', '가', '될텐데', '국방의무', '는', '더', '강조', '되', '야하는거', '아닌가요', '누구', '는', '전쟁', '하고', '싶은가요', '나라', '가', '강해야', '전쟁', '을', '안', '하는데', '차포', '빼면', '장기', '는', '뭘', '로', '두나요', '법', '이', '교리', '보다', '밑', '에', '있는거', '맞나요', '양심', '적', '신념', '으로', '납세', '거부', '하', '면', '그것', '도', '무죄', '인가요']"
28,0,왠만하면 댓글 안다는데 아들가진 엄마로써 천주교 신자로써 이번 판결은 형편성에 어긋나는거 같네요 천주교 계명중에 살인하지 말라는 말이 있는데 그럼 천주교 신자도 양심적 병역거부로 판결 받을수 있는지 묻고 싶네요,"['왠만하면', '댓글', '안다는데', '아들', '가진', '엄마', '로써', '천주교', '신자', '로써', '이번', '판결', '은', '형편', '성', '에', '어긋나는거', '같네요', '천주교', '계명', '중', '에', '살인', '하지', '말', '라는', '말', '이', '있는데', '그럼', '천주교', '신자', '도', '양심', '적', '병역', '거부', '로', '판결', '받을수', '있는지', '묻고', '싶네요']"
29,0,여호와의 증인이 문제가 아니고 이런 사태를 조장하고 부추긴 정권의 교묘함이 진짜 문제,"['여호와', '의', '증인', '이', '문제', '가', '아니고', '이런', '사태', '를', '조장', '하고', '부추긴', '정권', '의', '교묘함이', '진짜', '문제']"
30,0,육군 26개월 복무했고 김대중 노무현 문재인 투표한 사람입니다 어떻게 일개 종교 교리가 국민 4대의무 헌법위에 설수 있는지 묻고 싶습니다 제 정치적 가치관마저 회의가 오고 있습니다 이미 판결났으니 이 문제를 해결할 방법은 대체복무 5년정도면 괜찮을듯 합니다 늦었지만 현명한판단기다립니다,"['육군', '26', '개월', '복무', '했고', '김대중', '노무현', '문재인', '투표', '한', '사람', '입니다', '어떻게', '일개', '종교', '교리', '가', '국민', '4', '대', '의무', '헌법', '위', '에', '설수', '있는지', '묻고', '싶습니다', '제', '정치', '적', '가치관', '마저', '회의', '가', '오고', '있습니다', '이미', '판결', '났으니', '이', '문제', '를', '해결', '할', '방법', '은', '대체복무', '5년', '정도면', '괜찮을듯', '합니다', '늦었지만', '현명한', '판단', '기다립니다']"
31,0,대체복무는 최소 4년으로 해야한다 그래야 형평에  맞는다25 배로 대체 양심적으로 근무하게 하라,"['대체복무', '는', '최소', '4년', '으로', '해야', '한다', '그', '래야', '형평', '에', '맞는다', '25', '배', '로', '대체', '양심', '적', '으로', '근무', '하게', '하라']"
32,0,개인의 양심이라는 주관을 객관화할 수 있는 방법이 있는가 비양심적 병역복무자가 묻는다,"['개인', '의', '양심', '이라는', '주관', '을', '객관', '화할', '수', '있는', '방법', '이', '있는가', '비', '양심', '적', '병역', '복무', '자', '가', '묻는다']"
33,0,기독교불교천주교등등 대부분 정상적인 종교가 일순위로 말하는것이 사랑인데사랑하기에 도저히 적을 죽일 수없어 군에 못 가겠다고 주장하면 구지 여호와의 증인이 아니더라도 현역면제되는거 아닌가거기다 특정 종교가 없더라도 난 개인적은 양심과 가치관과 신념 때문에 총을 들수 없다면똑같지않나이제답은모병제뿐일듯,"['기독교', '불교', '천주교', '등등', '대부분', '정상', '적', '인', '종교', '가', '일', '순', '위로', '말', '하는것이', '사랑', '인데', '사랑', '하기에', '도저히', '적', '을', '죽일', '수', '없어', '군', '에', '못', '가겠다고', '주장', '하면', '구지', '여호와', '의', '증인', '이', '아니더라도', '현역', '면제', '되는거', '아닌가', '거기', '다', '특정', '종교', '가', '없더라도', '난', '개인', '적', '은', '양심', '과', '가치관', '과', '신념', '때문', '에', '총', '을', '들수', '없다면', '똑같지', '않나', '이제', '답', '은', '모병제', '뿐일듯']"
34,0,대법관이고 뭐고 군대 안갔다오면 어디든 출마못하게해야됨 요직에 못 앉게 해야 나라가 바로서지 군인을 이렇게 까지 비웃는 정부는 보다보다 처음본다,"['대법관', '이고', '뭐', '고', '군대', '안', '갔다오면', '어디', '든', '출마', '못', '하게', '해야', '됨', '요', '직', '에', '못', '앉게', '해야', '나라', '가', '바로', '서지', '군인', '을', '이렇게', '까지', '비웃는', '정부', '는', '보다보다', '처음', '본다']"
35,0,그냥주는거임 군대도 말살할려는거보니  그냥넘길려고 그러나,"['그냥', '주는거', '임', '군대', '도', '말살', '할려는', '거', '보니', '그냥', '넘길려고', '그러나']"
36,0,이쯤되면 군사쿠데타 일어나도 나는 환영한다,"['이쯤', '되면', '군사', '쿠데타', '일어나도', '나', '는', '환영', '한다']"
37,0,명칭을 좀 바꿨으면 좋겠는데‘비양심적 병역거부’ 딱좋은거같은데,"['명칭', '을', '좀', '바꿨으면', '좋겠는데', '‘', '비', '양심', '적', '병역', '거부', '’', '딱좋은', '거', '같은데']"
38,0,여호화의증인 이제 부터 국교가 될지도 모름 ㅋㅋ,"['여', '호화', '의', '증인', '이제', '부터', '국교', '가', '될지도', '모름', 'ㅋㅋ']"
39,0,참나라 돌아가는 꼴이어쩌다 이렇게 됐나,"['참나', '라', '돌아가는', '꼴', '이', '어쩌다', '이렇게', '됐나']"
40,0,내아들은 2주전에 전역했습니다ㆍ국민의 의무라지만  힘있는 자들의 아들은 이리저리 빠지고ㆍ별 되먹지않은 이유로 또 안가고ㆍ도대체 군복무는 누가 합니까한창 혈기왕성한 아이들을 군대에 가둬두고 그 안에서 뭔 일이 일어나고 있는지ㆍ아들이 복무중엔 저도 많이 불안했습니다ㆍ제발,"['내', '아들', '은', '2', '주전', '에', '전역', '했습니다', 'ㆍ', '국민', '의', '의무', '라지', '만', '힘', '있는', '자', '들', '의', '아들', '은', '이리저리', '빠지고', 'ㆍ', '별', '되', '먹지', '않은', '이유', '로', '또', '안', '가고', 'ㆍ', '도대체', '군복무', '는', '누가', '합', '니까', '한창', '혈기', '왕성', '한', '아이', '들', '을', '군대', '에', '가둬', '두고', '그', '안', '에서', '뭔', '일이', '일어나고', '있는지', 'ㆍ', '아들', '이', '복무', '중', '엔', '저', '도', '많이', '불안했습니다', 'ㆍ', '제발']"
41,0,국민의 의무 앞에서는 누구나 평등했으면 합니다ㆍ대체복무를 군복무와 맞먹는 힘든 일로 기간도 훨씬 길게 하길 바랍니다,"['국민', '의', '의무', '앞', '에서는', '누구', '나', '평등했으면', '합니다', 'ㆍ', '대체복무', '를', '군복무', '와', '맞먹는', '힘든', '일로', '기간', '도', '훨씬', '길게', '하길', '바랍니다']"
42,0,문정부지지했지만 요즘 하는꼴이  후회하게 만들어 담 총선때 생각좀 해봐야겠다는 생각이든다 누가 챤성했냐말이다 국민대다수가 납득을 못하는데,"['문정', '부지지', '했지만', '요즘', '하는', '꼴', '이', '후회', '하게', '만들어', '담', '총선', '때', '생각', '좀', '해봐야겠다는', '생각', '이든', '다', '누가', '챤', '성했냐', '말', '이다', '국민', '대다수', '가', '납득', '을', '못', '하는데']"
43,0,이번 무죄를 선고한 9인의 대법관은 모두 문재인 대통령의 임명을 받은 이들이다 정치로부터 독립적이어야 할 사법부가 적폐를 뿌리뽑겠다는 현정부에서도 마찬가지로 적폐로 남게 된 것이다 문제인 정부는 이명박근혜의 사법농단을 유산으로 삼아 정권만 바뀐 또다른 적폐의 길로 가고있다그간문정권의지지자로서발등이아프다,"['이번', '무죄', '를', '선고', '한', '9', '인의', '대법관', '은', '모두', '문재인', '대통령', '의', '임명', '을', '받은', '이', '들', '이다', '정치', '로부터', '독립', '적이어야', '할', '사법부', '가', '적폐', '를', '뿌리', '뽑겠다는', '현', '정부', '에서도', '마찬가지', '로', '적폐', '로', '남게', '된', '것', '이다', '문제', '인', '정부', '는', '이명', '박근혜', '의', '사법', '농단', '을', '유산', '으로', '삼아', '정권', '만', '바뀐', '또다른', '적폐', '의', '길', '로', '가고있다', '그간', '문', '정권', '의', '지지자', '로서', '발등', '이', '아프다']"
44,0,진짜 이해 안되는 일이 연속적으로 일어남 ,"['진짜', '이해', '안되는', '일이', '연속', '적', '으로', '일어남']"
45,0,살생금지는 불교 아닌가  임진왜란때의 승병들이 들으시면 땅을 치시겠다,"['살생', '금지', '는', '불교', '아닌가', '임진왜란', '때', '의', '승', '병들이', '들으시면', '땅', '을', '치시겠다']"
