,score,text,token_review
1835,2, 문재인 폐 비리 탄핵  조작 인기 구걸 거지 sm 문화 부상 뒷 거래 조작  문재인 문체부 조 작 단 거지 sm 패 대중문화 상 조작 뒷 거래 부정 수상  문재인 부정부패 삼고 부정 수상 가담 범죄자 세월호 용해 선 동해 표 구걸 국정 농단 폐 탄핵 시키고 방탄 과잉 포장 여론몰이 언플 해외 뒷 거래 순위 조작 언론  조작 단 sm 문체부 뒷 거래 부정 수상 구속 해라  김숙 박나래 김남주 전현무 레드 벨벳 윤상 등 부정 수상 하고도 가책 느끼는 찐 따 주 제 파악 방송출연 정지 시켜,"['문재인', '폐', '비리', '탄핵', '조작', '인기', '구걸', '거지', 'sm', '문화', '부상', '뒷', '거래', '조작', '문재인', '문체부', '조', '작', '단', '거지', 'sm', '패', '대중문화', '상', '조작', '뒷', '거래', '부정', '수상', '문재인', '부정부패', '삼고', '부정', '수상', '가담', '범죄자', '세월호', '용해', '선', '동해', '표', '구걸', '국정', '농단', '폐', '탄핵', '시키고', '방탄', '과잉', '포장', '여론몰이', '언플', '해외', '뒷', '거래', '순위', '조작', '언론', '조작', '단', 'sm', '문체부', '뒷', '거래', '부정', '수상', '구속', '해', '라', '김숙', '박나래', '김남주', '전현무', '레드', '벨벳', '윤상', '등', '부정', '수상', '하고도', '가책', '느끼는', '찐', '따', '주', '제', '파악', '방송출연', '정지', '시켜']"
1836,2, 아직도 문재인 진실 얘기 해주는 없고 문재인 문외한 임 인증  각 기관 방송 언론 조 작 단 거지 sm 등 유착 조작 방송 문화 예술 한류 경제 말아먹고있음에도 불구 각 기관 고위 끼리 짜고 언론플레이 쇼 있고 전혀 바로잡을 안해  선거 철 인지도 떨어질 세월 쇼 통일 쇼 무능 덮고 여론 날조하는 국정 농단 쇼 대 퉁 문재인 기본 순서도 모르고 떨어진 지지율 올 리기 위 한쇼 업적 에만 급 급 통일 쇼 방송 언론 부정부패 감싸고 조 작 단 거지 sm 관련 된 방북 연예인 기준 없이 부정 책정 뒷 거래 조 작 단 구속  대중 뒷전 이고 비리 조작 단 패인 국정 농단 문재인 탄핵 ,"['아직도', '문재인', '진실', '얘기', '해주는', '없고', '문재인', '문외한', '임', '인증', '각', '기관', '방송', '언론', '조', '작', '단', '거지', 'sm', '등', '유착', '조작', '방송', '문화', '예술', '한류', '경제', '말아먹고있음에도', '불구', '각', '기관', '고위', '끼리', '짜고', '언론플레이', '쇼', '있고', '전혀', '바로잡을', '안해', '선거', '철', '인지도', '떨어질', '세월', '쇼', '통일', '쇼', '무능', '덮고', '여론', '날조하는', '국정', '농단', '쇼', '대', '퉁', '문재인', '기본', '순서도', '모르고', '떨어진', '지지율', '올', '리기', '위', '한쇼', '업적', '에만', '급', '급', '통일', '쇼', '방송', '언론', '부정부패', '감싸고', '조', '작', '단', '거지', 'sm', '관련', '된', '방북', '연예인', '기준', '없이', '부정', '책정', '뒷', '거래', '조', '작', '단', '구속', '대중', '뒷전', '이고', '비리', '조작', '단', '패인', '국정', '농단', '문재인', '탄핵']"
1837,2, 꼴랑 안경 쓰고 탈 코르셋 외치던 분 인가  ㅋㅋㅋㅋㅋㅋㅋㅋ 학력 아까운 멍청이,"['꼴랑', '안경', '쓰고', '탈', '코르셋', '외치던', '분', '인가', 'ㅋㅋㅋㅋㅋㅋㅋㅋ', '학력', '아까운', '멍청이']"
1838,2, 20 대 개잡쑤레기같 년놈 댓글 쓰지마라 ,"['20', '대', '개잡쑤레기같', '년놈', '댓글', '쓰지마라']"
1839,2, 쓉 돼지 아침 ㅈㄹ 열폭 그만하고 살좀 빼자,"['쓉', '돼지', '아침', 'ㅈㄹ', '열폭', '그만하고', '살좀', '빼자']"
1840,2, 년 누군데 자꾸 기어나와  2 아니 ㅆ  ㅂ 이딴 ㅋㅋㅋㅋㅋㅋ 누군지 모르는 듣보 줌마 나도 기자 해야겠다 ㅉㅉ,"['년', '누군데', '자꾸', '기어나와', '2', '아니', 'ㅆ', 'ㅂ', '이딴', 'ㅋㅋㅋㅋㅋㅋ', '누군지', '모르는', '듣보', '줌마', '나도', '기자', '해야겠다', 'ㅉㅉ']"
1841,2, 안경 써 넘 촌스러 웃겻음 어디서 60년 대 안경 찾아 썻는 ㅋ,"['안경', '써', '넘', '촌스러', '웃겻음', '어디서', '60년', '대', '안경', '찾아', '썻는', 'ㅋ']"
1842,2, 안경 착용 마세요 그래도 뉴스 전하 아나운서 안경 머리 축 늘어 트리 커피숍 일하는 알바생 같다 저러다가 프리 선언 여기저기 방송 나오겠지 솔 까 아나운서 얼마 벌지도 하면서 프리 선언 아나운서 들보 돈벌이 수단 방송 하는것 같,"['안경', '착용', '마세요', '그래도', '뉴스', '전하', '아나운서', '안경', '머리', '축', '늘어', '트리', '커피숍', '일', '하는', '알바생', '같다', '저러다가', '프리', '선언', '여기저기', '방송', '나오겠지', '솔', '까', '아나운서', '얼마', '벌지도', '하면서', '프리', '선언', '아나운서', '들보', '돈벌이', '수단', '방송', '하는것', '같']"
1843,2, 누구  웃고 간다,"['누구', '웃고', '간다']"
1844,2, 한남 역시 얼평못 잃어 아나운서 안경 끼던말던 말린 대추 같이 생긴 늙은 남아나운서도 안경 끼 잘만 나오는데 아나운서 안경 써 라마 많으 신지 ㅉ,"['한남', '역시', '얼평못', '잃어', '아나운서', '안경', '끼던말던', '말린', '대추', '같이', '생긴', '늙은', '남아나운서도', '안경', '끼', '잘만', '나오는데', '아나운서', '안경', '써', '라마', '많으', '신지', 'ㅉ']"
1845,2, 쿵쾅 들은 1년 365일 쉬는 날 없이 발광 이구나 ㅋㅋㅋㅋㅋㅋㅋㅋㅋ 대단하다,"['쿵쾅', '들은', '1년', '365일', '쉬는', '날', '없이', '발광', '이구나', 'ㅋㅋㅋㅋㅋㅋㅋㅋㅋ', '대단하다']"
1846,2, 냄져 특징 갖는 욕 잖아  ㅎㅎ,"['냄져', '특징', '갖는', '욕', '잖아', 'ㅎㅎ']"
1847,2, 임현주 보고 부들 거리 건 화장 발 사진 발 뒤 숨은 꼴 페미 들인듯  들보 모든 뛰어나니 ,"['임현주', '보고', '부들', '거리', '건', '화장', '발', '사진', '발', '뒤', '숨은', '꼴', '페미', '들인듯', '들보', '모든', '뛰어나니']"
1848,2, 별 관심 없다  먹고 살기 바빠 죽겠는데  남 직장 오피스 업무 는걸 내보내고 홍보 는걸 보게 되니 짜증난다 ,"['별', '관심', '없다', '먹고', '살기', '바빠', '죽겠는데', '남', '직장', '오피스', '업무', '는걸', '내보내고', '홍보', '는걸', '보게', '되니', '짜증난다']"
1849,0, 삼가 고인 명복 빕니다,"['삼가', '고인', '명복', '빕니다']"
1850,0, 여기 악플달지 마세요  그래도 가정 남편 이자 아버지 신데 분들 보시 가슴 아픕니다 ,"['여기', '악플달지', '마세요', '그래도', '가정', '남편', '이자', '아버지', '신데', '분들', '보시', '가슴', '아픕니다']"
1851,0, 부산 유명 식당 복도 마주쳤는데 20 대인 에게도 가볍게 목례 해주던 예의 있으신 분이었습니다 삼가고인의 명목 빕니다,"['부산', '유명', '식당', '복도', '마주쳤는데', '20', '대인', '에게도', '가볍게', '목례', '해주던', '예의', '있으신', '분이었습니다', '삼가고인의', '명목', '빕니다']"
1852,0, 개인 사를 떠나서 그래도 멋진 분이셨고  우리나라 대표 영화인 셨 는데  이렇게 가셨다니 마음 안좋네요  곳 가셔서도 멋진 삶 사시길 바랍니다  삼가 고인 명복 빕니다 ,"['개인', '사를', '떠나서', '그래도', '멋진', '분이셨고', '우리나라', '대표', '영화인', '셨', '는데', '이렇게', '가셨다니', '마음', '안좋네요', '곳', '가셔서도', '멋진', '삶', '사시길', '바랍니다', '삼가', '고인', '명복', '빕니다']"
1853,0, 김수미 님 신인 신혼여행 다녀와서 영화 찍는데 갑자기 노출 베드 신 요구 는걸 신성일 님 안된다며 막아줘서 모면 할수있었다고 평생 잊는다고하더군요  사생활 자유로운 영혼 이었던면도 있지만 정의 로움 또한 있었던 분 같아요,"['김수미', '님', '신인', '신혼여행', '다녀와서', '영화', '찍는데', '갑자기', '노출', '베드', '신', '요구', '는걸', '신성일', '님', '안된다며', '막아줘서', '모면', '할수있었다고', '평생', '잊는다고하더군요', '사생활', '자유로운', '영혼', '이었던면도', '있지만', '정의', '로움', '또한', '있었던', '분', '같아요']"
1854,0, 댓글 한심하다 아무리 평소 행실 별로 이었 다해 순간 잣 대 들이밀고 있네 일도 앞 어찌 될지 장담 하는게 인생 아주 정의 사도 넘어서 염라대왕 나섰네,"['댓글', '한심하다', '아무리', '평소', '행실', '별로', '이었', '다해', '순간', '잣', '대', '들이밀고', '있네', '일도', '앞', '어찌', '될지', '장담', '하는게', '인생', '아주', '정의', '사도', '넘어서', '염라대왕', '나섰네']"
1855,0, 개성 중요하지만 덕이 되는 삶 중요한듯,"['개성', '중요하지만', '덕이', '되는', '삶', '중요한듯']"
1856,0, 댓글 수준 이럼 ;;;,"['댓글', '수준', '이럼', ';;;']"
1857,0, 악플다는것 참 한심한 ,"['악플다는것', '참', '한심한']"
1858,0, 먹고 살기 힘드니 전부 감정 메 마르 어머니 할머니 세대 에는 최고 남자배우 하던데 삼가고인의 명복 빕니다,"['먹고', '살기', '힘드니', '전부', '감정', '메', '마르', '어머니', '할머니', '세대', '에는', '최고', '남자배우', '하던데', '삼가고인의', '명복', '빕니다']"
1859,0, 욕 해도 엄앵란 씨 자식 해야지 당사자 아닌 네티즌 욕 할까  우리 직접 피 해준것도 없는데  남편 바람 피지 않게 단 도리 돌아가신 분께는 애도 하는게 맞는것 같습니다  좋은 곳 가시길 빕니다 ,"['욕', '해도', '엄앵란', '씨', '자식', '해야지', '당사자', '아닌', '네티즌', '욕', '할까', '우리', '직접', '피', '해준것도', '없는데', '남편', '바람', '피지', '않게', '단', '도리', '돌아가신', '분께는', '애도', '하는게', '맞는것', '같습니다', '좋은', '곳', '가시길', '빕니다']"
1860,0, 멋있게 살다간 스타 중 스타 입니다  극락왕생 하시길,"['멋있게', '살다간', '스타', '중', '스타', '입니다', '극락왕생', '하시길']"
1861,0, 10 여 년전 뵈었는데 정말 후광  신성일 신성일 알겠더라 여든 넘은 나이 에도 몸매 관리 대단  사야 많지만 영화배우 로서 부동 탑 이자 전설 남 인물 임  명복 빕니다,"['10', '여', '년전', '뵈었는데', '정말', '후광', '신성일', '신성일', '알겠더라', '여든', '넘은', '나이', '에도', '몸매', '관리', '대단', '사야', '많지만', '영화배우', '로서', '부동', '탑', '이자', '전설', '남', '인물', '임', '명복', '빕니다']"
1862,0, 분 어떻게 살았던  그건 분 인생 사 우리 뭐라 권리 없겠죠  고인 명복  빌니다 ㅡㅡ,"['분', '어떻게', '살았던', '그건', '분', '인생', '사', '우리', '뭐라', '권리', '없겠죠', '고인', '명복', '빌니다', 'ㅡㅡ']"
1863,0, 독보 배우 스타 중 스타  삼가 고인 명복 빕니다,"['독보', '배우', '스타', '중', '스타', '삼가', '고인', '명복', '빕니다']"
1864,0, 고인 명복 빕니다  한국영 화 발전 기여 많이 해주셔서 감사합니다,"['고인', '명복', '빕니다', '한국영', '화', '발전', '기여', '많이', '해주셔서', '감사합니다']"
1865,0, 부디 곳 에선 편하게 만나소서,"['부디', '곳', '에선', '편하게', '만나소서']"
1866,0, 젊었을 젊음 영원할것 같지만  우리 모두 세상 지나고 있다 ,"['젊었을', '젊음', '영원할것', '같지만', '우리', '모두', '세상', '지나고', '있다']"
1867,0, 영화 에서는 장동건 정우성 존재 였지,"['영화', '에서는', '장동건', '정우성', '존재', '였지']"
1868,0, 결혼 살 아보  처자 식 최고 멋진 남자인것 같음  그런 남잔 노후 편안하고 죽 들안에서 행복한 죽음 맞이 죠  어쨋 든 고인 명복 빕니다 ,"['결혼', '살', '아보', '처자', '식', '최고', '멋진', '남자인것', '같음', '그런', '남잔', '노후', '편안하고', '죽', '들안에서', '행복한', '죽음', '맞이', '죠', '어쨋', '든', '고인', '명복', '빕니다']"
1869,0, 솔직히 남자배우 현재 한국 최고 배우는 딱 꽃보다할배 에나 오는 원년 멤버 분 ,"['솔직히', '남자배우', '현재', '한국', '최고', '배우는', '딱', '꽃보다할배', '에나', '오는', '원년', '멤버', '분']"
1870,0, 나이 어려 고인 대해 선 아는건 엄앵란 님 이랑 결혼 뿐이 모르지만 고인 살 생전 어떤 삶 사셨는지 모르지만  고인 욕 악플 다는건 정말 아닌거 같다  욕 악플 달 시간 본인 앞가림 하시길  삼가 고인 명복 빕니다 ,"['나이', '어려', '고인', '대해', '선', '아는건', '엄앵란', '님', '이랑', '결혼', '뿐이', '모르지만', '고인', '살', '생전', '어떤', '삶', '사셨는지', '모르지만', '고인', '욕', '악플', '다는건', '정말', '아닌거', '같다', '욕', '악플', '달', '시간', '본인', '앞가림', '하시길', '삼가', '고인', '명복', '빕니다']"
1871,0, 명복 빕니다,"['명복', '빕니다']"
1872,0,  죽었으면 아무리 나쁜 감정 있더라도 명복 빌어주는게 예의  전 두 x 종도 아닌데  젊었을 잘난 많이 울렸다고 그게 평생 죄 스럽게 살아야 하나  쪽 라면 몰라도 별개 악플달 자격 없다 ,"['죽었으면', '아무리', '나쁜', '감정', '있더라도', '명복', '빌어주는게', '예의', '전', '두', 'x', '종도', '아닌데', '젊었을', '잘난', '많이', '울렸다고', '그게', '평생', '죄', '스럽게', '살아야', '하나', '쪽', '라면', '몰라도', '별개', '악플달', '자격', '없다']"
1873,0, 고인 명복 빕니다 댓글 수준 한심하고 부끄럽네요 ,"['고인', '명복', '빕니다', '댓글', '수준', '한심하고', '부끄럽네요']"
1874,2, 고인 생전 업적 있어야 칭찬 하지 라곤 바람 핀 당연하다는 듯 언론 나와서 지껄이고 뇌물 받아 국 의원 자격 박탈 당한 틀 딱인데 고인 이라 욕 먹어야 돼,"['고인', '생전', '업적', '있어야', '칭찬', '하지', '라곤', '바람', '핀', '당연하다는', '듯', '언론', '나와서', '지껄이고', '뇌물', '받아', '국', '의원', '자격', '박탈', '당한', '틀', '딱인데', '고인', '이라', '욕', '먹어야', '돼']"
1875,2, 절대로 만나면 안되는 표본 ㅊ,"['절대로', '만나면', '안되는', '표본', 'ㅊ']"
1876,2, 최고 별  고인 욕 하긴 싫지만 난 할배 싫어했다,"['최고', '별', '고인', '욕', '하긴', '싫지만', '난', '할배', '싫어했다']"
1877,2, 그닥 에겐 바람 피던 할배 뿐,"['그닥', '에겐', '바람', '피던', '할배', '뿐']"
1878,2, 국회의원 하며 대구 계 유니버시아드 광고 관련 뇌물 받아 먹어 5년 중형 전과자 배우 붙여 추앙 하냐 ,"['국회의원', '하며', '대구', '계', '유니버시아드', '광고', '관련', '뇌물', '받아', '먹어', '5년', '중형', '전과자', '배우', '붙여', '추앙', '하냐']"
1879,2, 영화 줜 찍고 바람 줜 피고 에겐 최고 로망  에겐 머리털 뽑아 버리고 싶은  어찌 되었든 파란만장한 인생 막 내렸으니 곳 가서 바람 피고 된 짓 대한 벌은 받으시오 ,"['영화', '줜', '찍고', '바람', '줜', '피고', '에겐', '최고', '로망', '에겐', '머리털', '뽑아', '버리고', '싶은', '어찌', '되었든', '파란만장한', '인생', '막', '내렸으니', '곳', '가서', '바람', '피고', '된', '짓', '대한', '벌은', '받으시오']"
1880,2, 결혼 걸러 야하는 대표 분,"['결혼', '걸러', '야하는', '대표', '분']"
1881,2, 죽으면 쓰레기 찬양 해야되  평생 처자 식 가슴 대못 박고 쾌락 찾느라 밖 으로만 나돈 죽었다고 비난 하지 라니 개돼지 따로 없네,"['죽으면', '쓰레기', '찬양', '해야되', '평생', '처자', '식', '가슴', '대못', '박고', '쾌락', '찾느라', '밖', '으로만', '나돈', '죽었다고', '비난', '하지', '라니', '개돼지', '따로', '없네']"
1882,2, 670년 대 최고 별 이었던  이라고 써야 맞지  딱 시절 에나 최고 였지  시대 어느 시 댄데 최고 래  최악 된지 오래 구만,"['670년', '대', '최고', '별', '이었던', '이라고', '써야', '맞지', '딱', '시절', '에나', '최고', '였지', '시대', '어느', '시', '댄데', '최고', '래', '최악', '된지', '오래', '구만']"
1883,2, 최고 별 ㅋㅋㅋ 최고 바람둥이 밉 상 남편 겠지 ㅋㅋㅋㅋ,"['최고', '별', 'ㅋㅋㅋ', '최고', '바람둥이', '밉', '상', '남편', '겠지', 'ㅋㅋㅋㅋ']"
1884,2, 별 무슨 ,"['별', '무슨']"
1885,2, 양반 지옥 갔을듯,"['양반', '지옥', '갔을듯']"
1886,2, 빌어먹을 노친 행보 얼마나 더러웠으면 죽어서도 악플 시달리는 중,"['빌어먹을', '노친', '행보', '얼마나', '더러웠으면', '죽어서도', '악플', '시달리는', '중']"
1887,2, 최고 별 이라니  최고 별 방탄 오빠 들임 ㅋㅋㅋㅋㅋ,"['최고', '별', '이라니', '최고', '별', '방탄', '오빠', '들임', 'ㅋㅋㅋㅋㅋ']"
1888,2, ㅋㅋㅋ 추모 개뿔 노망 난 바람둥이,"['ㅋㅋㅋ', '추모', '개뿔', '노망', '난', '바람둥이']"
1889,2, 바람 핀거 욕 이재명 ㅊ ㅕ 감싸 고도  노회찬 자살 뇌물 먹고 뒤졌다 고인 드립치며 부들대던 새 ㄲ ㅣ 들이 여기 선 온갖 더러운 소릴 해대  도대체 좌빨 매사 로남불 이여,"['바람', '핀거', '욕', '이재명', 'ㅊ', 'ㅕ', '감싸', '고도', '노회찬', '자살', '뇌물', '먹고', '뒤졌다', '고인', '드립치며', '부들대던', '새', 'ㄲ', 'ㅣ', '들이', '여기', '선', '온갖', '더러운', '소릴', '해대', '도대체', '좌빨', '매사', '로남불', '이여']"
1890,2, 별 개뿔 똥 아까워 피응싄 ,"['별', '개뿔', '똥', '아까워', '피응싄']"
1891,2, 죽어 버렸군 망할 노친,"['죽어', '버렸군', '망할', '노친']"
1892,2, 뭔 최고 ;; 갖다 붙일 걸 붙라,"['뭔', '최고', ';;', '갖다', '붙일', '걸', '붙라']"
1893,2, 어차피 죽을거 오 보였다고 하지말자 이기 ㅇ ㅑ  훌륭한 예언 아니었노  ㅋㅋㅋㅋ,"['어차피', '죽을거', '오', '보였다고', '하지말자', '이기', 'ㅇ', 'ㅑ', '훌륭한', '예언', '아니었노', 'ㅋㅋㅋㅋ']"
1894,2, 하루 3 갑 피운 얼굴,"['하루', '3', '갑', '피운', '얼굴']"
1895,2, 광대 처럼 살다 광대 처럼 간 광대 ,"['광대', '처럼', '살다', '광대', '처럼', '간', '광대']"
1896,2, 곱 늙었으면 참 좋았을것을  불쌍하네  말년 중요해 ,"['곱', '늙었으면', '참', '좋았을것을', '불쌍하네', '말년', '중요해']"
1897,2, 극 페미 소수 장악 네이버 댓글 판 ㅉㅉ,"['극', '페미', '소수', '장악', '네이버', '댓글', '판', 'ㅉㅉ']"
1898,0, 요란한 무대 특이한 복장 아니라  본인 가진 선하고 긍정 에너지 전 해주는 가수  너그러 움 긍정 배우고 싶네여,"['요란한', '무대', '특이한', '복장', '아니라', '본인', '가진', '선하고', '긍정', '에너지', '전', '해주는', '가수', '너그러', '움', '긍정', '배우고', '싶네여']"
1899,0, 노라조 무대 실제 본적 2 번 있다  강렬한 율동 비트 실력 없으면 절대 소화 함  빌보드 갈 됐는데,"['노라조', '무대', '실제', '본적', '2', '번', '있다', '강렬한', '율동', '비트', '실력', '없으면', '절대', '소화', '함', '빌보드', '갈', '됐는데']"
1900,0, 성격 낙천 ,"['성격', '낙천']"
1901,0, 진심 방송 보고 팬 됐음  저런 프로 정신 ,"['진심', '방송', '보고', '팬', '됐음', '저런', '프로', '정신']"
1902,0, 조 빈씨 잘생겼네요 ,"['조', '빈씨', '잘생겼네요']"
1903,0, 허세 1 없고 거만 1 없고 오히려 겸손하네  진심 팬 됐음,"['허세', '1', '없고', '거만', '1', '없고', '오히려', '겸손하네', '진심', '팬', '됐음']"
1904,0, 이형 나혼자산다 오기 정말 오랜 시간 노력 인내 있었다고 본다  이제 됬으면 좋겠다,"['이형', '나혼자산다', '오기', '정말', '오랜', '시간', '노력', '인내', '있었다고', '본다', '이제', '됬으면', '좋겠다']"
1905,0, 이렇게 열심히 분 꼭 더더 성공했으면 ,"['이렇게', '열심히', '분', '꼭', '더더', '성공했으면']"
1906,0, 우리 회사 행사 왔는데 백이 백 사진 찍어 줌 항상 건강하고 행복하길 바랄게 용  멀리 살 지만 응원 합니다  ♡,"['우리', '회사', '행사', '왔는데', '백이', '백', '사진', '찍어', '줌', '항상', '건강하고', '행복하길', '바랄게', '용', '멀리', '살', '지만', '응원', '합니다', '♡']"
1907,0, 조빈 가창력 있고 실력 파 라는 건 아는 안다  코믹 가려져 있을 뿐  열정 만큼 되길 ,"['조빈', '가창력', '있고', '실력', '파', '라는', '건', '아는', '안다', '코믹', '가려져', '있을', '뿐', '열정', '만큼', '되길']"
1908,0, 열심히 산다 분 많이 벌어야 되는데,"['열심히', '산다', '분', '많이', '벌어야', '되는데']"
1909,0, 강아지 귀염 ㅠㅠㅠㅠ 세상 순함 ㅠㅠ,"['강아지', '귀염', 'ㅠㅠㅠㅠ', '세상', '순함', 'ㅠㅠ']"
1910,0, 남성 팬 많은 가수  보는이로 하여금 웃음 자아내는 가수 지만 인성 참된 진실된 조 빈씨  삶 대하 자세 멋지네요  다시 한번 전성기 맞이 하시길 진심 빕니다 ,"['남성', '팬', '많은', '가수', '보는이로', '하여금', '웃음', '자아내는', '가수', '지만', '인성', '참된', '진실된', '조', '빈씨', '삶', '대하', '자세', '멋지네요', '다시', '한번', '전성기', '맞이', '하시길', '진심', '빕니다']"
1911,0, 분 악플다는거 자체 된듯 열심히 사는 이고 본분 충실하면서 대중 힘 되는  화이팅 하세요 ,"['분', '악플다는거', '자체', '된듯', '열심히', '사는', '이고', '본분', '충실하면서', '대중', '힘', '되는', '화이팅', '하세요']"
1912,0, 조빈 사실 상당히 잘생긴 얼굴,"['조빈', '사실', '상당히', '잘생긴', '얼굴']"
1913,0, 무대 위 랑 다르게 조신 참하 심 ㅎㅎ 흥 하세요 ,"['무대', '위', '랑', '다르게', '조신', '참하', '심', 'ㅎㅎ', '흥', '하세요']"
1914,0, 다소 특이하고 요란한 컨셉 와도 한번 부정 거나 이상하다고 해본 없었어요  어제 방송 보고 더욱 팬 됐어요  좋아하는 음악 유쾌한 모습 많이 보여주셨으면 좋겠어요 ,"['다소', '특이하고', '요란한', '컨셉', '와도', '한번', '부정', '거나', '이상하다고', '해본', '없었어요', '어제', '방송', '보고', '더욱', '팬', '됐어요', '좋아하는', '음악', '유쾌한', '모습', '많이', '보여주셨으면', '좋겠어요']"
1915,0, 차 앉을 매니저 옆 조 수석 앉아주는 센스 하며  팬 먼저 다가가 사진 찍어주고  이웃 주민 친하게 지내는 태도 보며  형 괜찮은 이구나  했다 ,"['차', '앉을', '매니저', '옆', '조', '수석', '앉아주는', '센스', '하며', '팬', '먼저', '다가가', '사진', '찍어주고', '이웃', '주민', '친하게', '지내는', '태도', '보며', '형', '괜찮은', '이구나', '했다']"
1916,0, 조빈 님 행사 뵌 적있는데 공연 차 타고 나가는데 몰려 있으니까 창문 열고 친절하게 조심하시라고 사진 포즈 해주시는거 보고 인성 정말 대박 이라고 느낌,"['조빈', '님', '행사', '뵌', '적있는데', '공연', '차', '타고', '나가는데', '몰려', '있으니까', '창문', '열고', '친절하게', '조심하시라고', '사진', '포즈', '해주시는거', '보고', '인성', '정말', '대박', '이라고', '느낌']"
1917,0, 정말 몸 실천 연예인 예의 몸 뵈어있더라구요,"['정말', '몸', '실천', '연예인', '예의', '몸', '뵈어있더라구요']"
1918,0, 라스 열심히 그리고 긍정 사고방식 존경  대승 하시길 ,"['라스', '열심히', '그리고', '긍정', '사고방식', '존경', '대승', '하시길']"
1919,0, 보통 저런거 가수 노래 노래 같이 까이는데  형 노래  그리고 무엇 심성 올 곧 같아서 참 좋아 ,"['보통', '저런거', '가수', '노래', '노래', '같이', '까이는데', '형', '노래', '그리고', '무엇', '심성', '올', '곧', '같아서', '참', '좋아']"
1920,0, 노라조 흥 하자,"['노라조', '흥', '하자']"
1921,0, 고등학생 반 였는데 매우 조용했던 친구  더욱 흥 해라  응원 ,"['고등학생', '반', '였는데', '매우', '조용했던', '친구', '더욱', '흥', '해', '라', '응원']"
1922,0, 방송 나온 모습 실생활 같다면 이분 참 열심히 겸손한 마음 사시네요  꼭  흥 하세요  사이다 광고 찍으면 좋겠어요 ,"['방송', '나온', '모습', '실생활', '같다면', '이분', '참', '열심히', '겸손한', '마음', '사시네요', '꼭', '흥', '하세요', '사이다', '광고', '찍으면', '좋겠어요']"
